{
  "$schema": "config/framework_patterns.schema.json",
  "schema_version": "1.0",
  "generated_at": "2026-04-28T00:00:00Z",
  "generated_by": "scripts/red_pill_mapper.py --export-framework-config",

  "frameworks": {
    "react": {
      "last_reviewed_version": "18.3.1",
      "autoescape": {
        "default_safe_contexts": ["html_body", "html_attribute"],
        "bypass_markers": ["dangerouslySetInnerHTML"],
        "context_notes": "JSX {} expressions are auto-escaped; only dangerouslySetInnerHTML is raw."
      },
      "detection": {
        "signals": ["\\bReact\\b", "from ['\"]react['\"]", "dangerouslySetInnerHTML"],
        "default_escape_contexts": ["html_body"],
        "trusted_bypass_apis": ["dangerouslySetInnerHTML"],
        "notes": "React escapes text children by default; dangerouslySetInnerHTML is raw HTML."
      }
    },
    "django_jinja": {
      "last_reviewed_version": "5.1",
      "autoescape": {
        "default_safe_contexts": ["html_body", "html_attribute"],
        "bypass_markers": ["|safe", "mark_safe", "{% autoescape off %}"],
        "context_notes": "Django/Jinja2 auto-escapes {{ var }}; safe filter and mark_safe bypass it."
      },
      "detection": {
        "signals": ["\\{\\{.*\\}\\}", "{%\\s*autoescape", "\\|\\s*safe\\b", "mark_safe"],
        "default_escape_contexts": ["html_body", "html_attribute"],
        "trusted_bypass_apis": ["safe filter", "mark_safe"],
        "notes": "Autoescape may protect template interpolation unless disabled or bypassed."
      }
    },
    "rails_erb": {
      "last_reviewed_version": "7.2",
      "autoescape": {
        "default_safe_contexts": ["html_body"],
        "bypass_markers": ["html_safe", "raw(", "<%=="],
        "context_notes": "ERB <%= %> escapes by default; <%== %> and .html_safe bypass."
      },
      "detection": {
        "signals": ["<%=", "\\.html_safe\\b", "\\braw\\s*\\("],
        "default_escape_contexts": ["html_body"],
        "trusted_bypass_apis": ["html_safe", "raw"],
        "notes": "Escaped ERB output is safer; raw/html_safe bypasses escaping."
      }
    },
    "aspnet_razor": {
      "last_reviewed_version": "9.0",
      "autoescape": {
        "default_safe_contexts": ["html_body"],
        "bypass_markers": ["Html.Raw("],
        "context_notes": "Razor @Model expressions are encoded; Html.Raw bypasses."
      },
      "detection": {
        "signals": ["\\bHtml\\.Raw\\s*\\(", "\\.cshtml\\b", "@Model"],
        "default_escape_contexts": ["html_body"],
        "trusted_bypass_apis": ["Html.Raw"],
        "notes": "Razor encodes normal output; Html.Raw bypasses encoding."
      }
    },
    "vue": {
      "last_reviewed_version": "3.5",
      "autoescape": {
        "default_safe_contexts": ["html_body"],
        "bypass_markers": ["v-html"],
        "context_notes": "Vue {{ }} text interpolation is escaped; v-html interprets HTML."
      },
      "detection": {
        "signals": ["\\bv-html\\b", "\\{\\{.*\\}\\}"],
        "default_escape_contexts": ["html_body"],
        "trusted_bypass_apis": ["v-html"],
        "notes": "Mustache text is escaped; v-html interprets HTML."
      }
    },
    "angular": {
      "last_reviewed_version": "19.0",
      "autoescape": {
        "default_safe_contexts": ["html_body"],
        "bypass_markers": ["bypassSecurityTrustHtml", "bypassSecurityTrustUrl", "[innerHTML]"],
        "context_notes": "Angular sanitizes bindings; bypassSecurityTrust* APIs bypass it."
      },
      "detection": {
        "signals": ["bypassSecurityTrust", "\\[innerHTML\\]", "ng-bind-html"],
        "default_escape_contexts": ["html_body"],
        "trusted_bypass_apis": ["bypassSecurityTrustHtml", "bypassSecurityTrustUrl"],
        "notes": "Angular sanitizes some bindings; bypass APIs explicitly trust content."
      }
    },
    "express": {
      "last_reviewed_version": "5.0.0",
      "autoescape": {
        "default_safe_contexts": ["html_body"],
        "bypass_markers": ["<%-", "!=", "{{{", "res.send("],
        "context_notes": "Express delegates escaping to the template engine. EJS <%= %> auto-escapes; <%- %> is raw. Pug = auto-escapes; != is raw. Handlebars {{ }} auto-escapes; {{{ }}} is raw. res.send() sends raw bytes."
      },
      "detection": {
        "signals": ["require\\(['\"]express['\"]", "res\\.render\\s*\\(", "res\\.send\\s*\\(", "<%-"],
        "default_escape_contexts": ["html_body"],
        "trusted_bypass_apis": ["<%- (EJS raw)", "!= (Pug raw)", "{{{ (Handlebars raw)"],
        "notes": "Express template engines (EJS, Pug, Handlebars) auto-escape by default; raw-output syntax bypasses escaping."
      }
    },
    "fastapi": {
      "last_reviewed_version": "0.115.0",
      "autoescape": {
        "default_safe_contexts": ["html_body", "html_attribute"],
        "bypass_markers": ["|safe", "Markup(", "mark_safe"],
        "context_notes": "FastAPI uses Jinja2 via Starlette's Jinja2Templates. Jinja2 auto-escapes {{ var }}; |safe filter and Markup() bypass it."
      },
      "detection": {
        "signals": ["FastAPI\\b", "from\\s+fastapi", "Jinja2Templates", "TemplateResponse", "@app\\.(?:get|post|put|delete|patch)"],
        "default_escape_contexts": ["html_body", "html_attribute"],
        "trusted_bypass_apis": ["|safe filter", "Markup()"],
        "notes": "Jinja2 auto-escapes template interpolation; safe filter and Markup() bypass."
      }
    },
    "flask": {
      "last_reviewed_version": "3.1.0",
      "autoescape": {
        "default_safe_contexts": ["html_body", "html_attribute"],
        "bypass_markers": ["|safe", "Markup(", "mark_safe", "{% autoescape off %}"],
        "context_notes": "Flask uses Jinja2, which auto-escapes {{ var }} by default. |safe, Markup(), mark_safe, and {% autoescape off %} bypass it."
      },
      "detection": {
        "signals": ["render_template\\s*\\(", "render_template_string\\s*\\(", "from\\s+flask\\s+import", "@app\\.route\\s*\\(", "Flask\\(__name__\\)"],
        "default_escape_contexts": ["html_body", "html_attribute"],
        "trusted_bypass_apis": ["|safe filter", "Markup()", "mark_safe"],
        "notes": "Jinja2 auto-escapes by default; render_template_string with user input is SSTI."
      }
    },
    "go_nethttp": {
      "last_reviewed_version": "1.23.0",
      "autoescape": {
        "default_safe_contexts": ["html_body", "html_attribute", "js_body", "url"],
        "bypass_markers": ["template.HTML(", "template.JS(", "template.URL(", "template.CSS(", "text/template"],
        "context_notes": "Go html/template auto-escapes contextually (HTML, JS, CSS, URLs). template.HTML() etc. bypass. text/template does NOT auto-escape."
      },
      "detection": {
        "signals": ["html/template", "template\\.HTML\\s*\\(", "template\\.JS\\s*\\(", "text/template", "\\.HandleFunc\\s*\\(", "template\\.Must\\s*\\("],
        "default_escape_contexts": ["html_body", "html_attribute", "js_body", "url"],
        "trusted_bypass_apis": ["template.HTML", "template.JS", "template.URL", "template.CSS"],
        "notes": "html/template contextually auto-escapes; text/template does not. Bypass types exist for each context."
      }
    },
    "handlebars": {
      "last_reviewed_version": "4.7.0",
      "autoescape": {
        "default_safe_contexts": ["html_body"],
        "bypass_markers": ["{{{"],
        "context_notes": "Handlebars {{ }} auto-escapes HTML; {{{ }}} triple-stash outputs raw HTML."
      },
      "detection": {
        "signals": ["\\{\\{\\{", "Handlebars\\.compile", "require\\(['\"]handlebars['\"]", "\\.hbs\\b"],
        "default_escape_contexts": ["html_body"],
        "trusted_bypass_apis": ["{{{ triple-stash"],
        "notes": "Double-stash escapes; triple-stash bypasses. Also used server-side in Express apps."
      }
    },
    "htmx": {
      "last_reviewed_version": "2.0.0",
      "autoescape": {
        "default_safe_contexts": [],
        "bypass_markers": [],
        "context_notes": "HTMX is an HTML extension library, not a template engine. It swaps server-rendered HTML fragments via hx-swap. No built-in auto-escape — the server MUST sanitise responses. hx-swap=innerHTML interprets responses as raw HTML."
      },
      "detection": {
        "signals": ["hx-swap\\s*=", "hx-target\\s*=", "hx-get\\s*=", "hx-post\\s*=", "htmx\\.org", "\\bhtmx\\b"],
        "default_escape_contexts": [],
        "trusted_bypass_apis": [],
        "notes": "HTMX provides zero output encoding. Every hx-swap=innerHTML is a potential XSS sink if the server response is not sanitised."
      }
    },
    "laravel_blade": {
      "last_reviewed_version": "12.0.0",
      "autoescape": {
        "default_safe_contexts": ["html_body"],
        "bypass_markers": ["{!!", "!!}"],
        "context_notes": "Blade {{ }} auto-escapes by default; {!! !!} outputs raw HTML. Blade::withoutDoubleEncoding() disables double-encoding."
      },
      "detection": {
        "signals": ["\\{\\!\\!", "\\bBlade::", "@extends\\b", "@section\\b", "@yield\\b", "View::make\\s*\\("],
        "default_escape_contexts": ["html_body"],
        "trusted_bypass_apis": ["{!! raw echo"],
        "notes": "Blade auto-escapes {{ }}; {!! !!} bypasses. Custom Blade directives should be audited."
      }
    },
    "nextjs": {
      "last_reviewed_version": "15.0.0",
      "autoescape": {
        "default_safe_contexts": ["html_body"],
        "bypass_markers": ["dangerouslySetInnerHTML"],
        "context_notes": "Next.js uses React JSX which auto-escapes { } expressions. dangerouslySetInnerHTML bypasses. Server Components and Server Actions are new XSS surfaces."
      },
      "detection": {
        "signals": ["next/", "\\bnextjs\\b", "use\\s+server", "use\\s+client", "getServerSideProps", "getStaticProps", "NextApiHandler"],
        "default_escape_contexts": ["html_body"],
        "trusted_bypass_apis": ["dangerouslySetInnerHTML"],